symbol,yf_symbol,name,aum,aum_date,source,status,last_checked,error
VSDB,VSDB,Vanguard Short Duration Bond ETF Shares,895731008.0,2026-07-08,yfinance,ok,2026-07-08T15:01:03Z,
SCO,SCO,ProShares UltraShort Bloomberg Crude Oil,894481024.0,2026-07-08,yfinance,ok,2026-07-08T14:56:57Z,
SDVD,SDVD,FT Vest SMID Rising Dividend Achievers Target Income ETF,893140864.0,2026-07-08,yfinance,ok,2026-07-08T14:57:03Z,
PID,PID,Invesco International Dividend Achievers ETF,890847360.0,2026-07-08,yfinance,ok,2026-07-08T14:54:28Z,
IUS,IUS,Invesco RAFI Strategic US ETF,882063552.0,2026-07-08,yfinance,ok,2026-07-08T14:49:52Z,
EVMO,EVMO,Eaton Vance Mortgage Opportunities ETF,881780864.0,2026-07-08,yfinance,ok,2026-07-08T14:44:32Z,
JDVL,JDVL,John Hancock Disciplined Value Select ETF,880019968.0,2026-07-08,yfinance,ok,2026-07-08T16:00:46Z,
PPH,PPH,VanEck Pharmaceutical ETF,879456640.0,2026-07-08,yfinance,ok,2026-07-08T14:54:40Z,
OUSM,OUSM,ALPS O'Shares U.S. Small-Cap Quality Dividend ETF Shares,878128256.0,2026-07-08,yfinance,ok,2026-07-08T14:53:54Z,
IBDZ,IBDZ,iShares iBonds Dec 2034 Term Corporate ETF,878118592.0,2026-07-08,yfinance,ok,2026-07-08T14:48:31Z,
GFLW,GFLW,VictoryShares Free Cash Flow Growth ETF,877443072.0,2026-07-08,yfinance,ok,2026-07-08T14:46:58Z,
SAMT,SAMT,Strategas Macro Thematic Opportunities ETF,876693248.0,2026-07-08,yfinance,ok,2026-07-08T14:56:41Z,
NOEQ,NOEQ,NORTHERN TRUST US EQUITY ETF,875699712.0,2026-07-08,yfinance,ok,2026-07-08T14:53:17Z,
REZ,REZ,iShares Residential and Multisector Real Estate ETF,874721280.0,2026-07-08,yfinance,ok,2026-07-08T14:56:03Z,
SCHJ,SCHJ,Schwab 1-5 Year Corporate Bond ETF,870178816.0,2026-07-08,yfinance,ok,2026-07-08T14:56:51Z,
CVLC,CVLC,Calvert US Large-Cap Core Responsible Index ETF,869048256.0,2026-07-08,yfinance,ok,2026-07-08T14:42:21Z,
GWX,GWX,State Street SPDR S&P International Small Cap ETF,868631296.0,2026-07-08,yfinance,ok,2026-07-08T14:47:40Z,
INFO,INFO,Harbor PanAgora Dynamic Large Cap Core ETF,864906944.0,2026-07-08,yfinance,ok,2026-07-08T14:49:29Z,
KORP,KORP,American Century Diversified Corporate Bond ETF,864559040.0,2026-07-08,yfinance,ok,2026-07-08T14:51:08Z,
PBPH,PBPH,Portfolio Building Block World Pharma And Biotech Index ETF,859368448.0,2026-07-08,yfinance,ok,2026-07-08T14:54:06Z,
IBHF,IBHF,iShares iBonds 2026 Term High Yield and Income ETF,857518336.0,2026-07-08,yfinance,ok,2026-07-08T14:48:34Z,
FLGB,FLGB,Franklin FTSE United Kingdom ETF,857387136.0,2026-07-08,yfinance,ok,2026-07-08T14:45:43Z,
BSJR,BSJR,Invesco BulletShares 2027 High Yield Corporate Bond ETF,853669120.0,2026-07-08,yfinance,ok,2026-07-08T14:40:45Z,
TPYP,TPYP,Tortoise North American Pipeline Fund,853045120.0,2026-07-08,yfinance,ok,2026-07-08T14:59:35Z,
PRIV,PRIV,State Street IG Public & Private Credit ETF,851615808.0,2026-07-08,yfinance,ok,2026-07-08T14:54:45Z,
UFO,UFO,Procure Space ETF,850630912.0,2026-07-08,yfinance,ok,2026-07-08T15:00:00Z,
FLBL,FLBL,Franklin Senior Loan ETF,847092736.0,2026-07-08,yfinance,ok,2026-07-08T14:45:38Z,
JCPI,JCPI,JPMorgan Inflation Managed Bond ETF,846971712.0,2026-07-08,yfinance,ok,2026-07-08T14:50:19Z,
AUSF,AUSF,Global X Adaptive U.S. Factor ETF,846885376.0,2026-07-08,yfinance,ok,2026-07-08T14:39:17Z,
VFVA,VFVA,Vanguard U.S. Value Factor ETF Shares,845196032.0,2026-07-08,yfinance,ok,2026-07-08T15:00:44Z,
AVRE,AVRE,Avantis Real Estate ETF,844656256.0,2026-07-08,yfinance,ok,2026-07-08T14:39:25Z,
THYF,THYF,T. Rowe Price U.S. High Yield ETF,843656384.0,2026-07-08,yfinance,ok,2026-07-08T14:59:07Z,
ARGT,ARGT,Global X MSCI Argentina ETF,842971264.0,2026-07-08,yfinance,ok,2026-07-08T14:39:03Z,
GSG,GSG,iShares S&P GSCI Commodity-Indexed Trust,839283008.0,2026-07-08,yfinance,ok,2026-07-08T14:47:28Z,
LSGR,LSGR,Natixis Loomis Sayles Focused Growth ETF,839075264.0,2026-07-08,yfinance,ok,2026-07-08T14:51:43Z,
NUKZ,NUKZ,Range Nuclear Renaissance ETF,837039680.0,2026-07-08,yfinance,ok,2026-07-08T14:53:26Z,
QCLN,QCLN,First Trust NASDAQ Clean Edge Green Energy Index Fund,836674944.0,2026-07-08,yfinance,ok,2026-07-08T14:55:21Z,
NBCR,NBCR,Neuberger Core Equity ETF,835535552.0,2026-07-08,yfinance,ok,2026-07-08T14:53:01Z,
TILC,TILC,Thrivent International Large Cap ETF,834743808.0,2026-07-08,yfinance,ok,2026-07-08T15:30:43Z,
ISHG,ISHG,iShares 1-3 Year International Treasury Bond ETF,831361792.0,2026-07-08,yfinance,ok,2026-07-08T14:49:43Z,
RGEF,RGEF,Rockefeller Global Equity ETF,831039936.0,2026-07-08,yfinance,ok,2026-07-08T14:56:06Z,
PCEF,PCEF,Invesco CEF Income Composite ETF,830461056.0,2026-07-08,yfinance,ok,2026-07-08T14:54:09Z,
SLVP,SLVP,iShares MSCI Global Silver and Metals Miners ETF,822772480.0,2026-07-08,yfinance,ok,2026-07-08T14:57:33Z,
FDD,FDD,First Trust STOXX European Select Dividend Index Fund,820830464.0,2026-07-08,yfinance,ok,2026-07-08T14:45:01Z,
BBEM,BBEM,JPMorgan Betabuilders Emerging Markets Equity ETF,820816384.0,2026-07-08,yfinance,ok,2026-07-08T14:39:41Z,
JVAL,JVAL,JPMorgan U.S. Value Factor ETF,820616000.0,2026-07-08,yfinance,ok,2026-07-08T14:50:52Z,
DOL,DOL,WisdomTree True Developed International Fund,814840128.0,2026-07-08,yfinance,ok,2026-07-08T14:43:11Z,
EYLD,EYLD,Cambria Emerging Shareholder Yield ETF,814765184.0,2026-07-08,yfinance,ok,2026-07-08T14:44:46Z,
FXU,FXU,First Trust Utilities AlphaDEX Fund,814476864.0,2026-07-08,yfinance,ok,2026-07-08T14:46:39Z,
AOK,AOK,iShares Core 30/70 Conservative Allocation ETF,812926144.0,2026-07-08,yfinance,ok,2026-07-08T14:38:54Z,
VOLT,VOLT,Tema Electrification ETF,809755840.0,2026-07-08,yfinance,ok,2026-07-08T15:00:56Z,
MGNR,MGNR,American Beacon GLG Natural Resources ETF,809536448.0,2026-07-08,yfinance,ok,2026-07-08T14:52:15Z,
EQAL,EQAL,Invesco Russell 1000 Equal Weight ETF,808397952.0,2026-07-08,yfinance,ok,2026-07-08T14:44:16Z,
AGIX,AGIX,KraneShares Artificial Intelligence and Technology Public and Private ETF,807395392.0,2026-07-08,yfinance,ok,2026-07-08T14:38:34Z,
AMJB,AMJB,Alerian MLP Index ETN,805159552.0,2026-07-08,yfinance,ok,2026-07-08T14:38:50Z,
BGDV,BGDV,Bahl & Gaynor Dividend ETF,804775616.0,2026-07-08,yfinance,ok,2026-07-08T14:40:03Z,
MISL,MISL,First Trust Indxx Aerospace & Defense ETF,801873408.0,2026-07-08,yfinance,ok,2026-07-08T14:52:20Z,
FDV,FDV,Federated Hermes U.S. Strategic Dividend ETF,799100032.0,2026-07-08,yfinance,ok,2026-07-08T14:45:09Z,
EWI,EWI,iShares MSCI Italy ETF,795777024.0,2026-07-08,yfinance,ok,2026-07-08T14:44:37Z,
KOKU,KOKU,Xtrackers MSCI Kokusai Equity ETF,795114880.0,2026-07-08,yfinance,ok,2026-07-08T14:51:06Z,
GCOR,GCOR,Goldman Sachs Access U.S. Aggregate Bond ETF,794266240.0,2026-07-08,yfinance,ok,2026-07-08T14:46:49Z,
MIGO,MIGO,Mig Core ETF,786543232.0,2026-07-08,yfinance,ok,2026-07-08T14:52:18Z,
RSMC,RSMC,Rockefeller U.S. Small-Mid Cap ETF,784725888.0,2026-07-08,yfinance,ok,2026-07-08T14:56:26Z,
HMOP,HMOP,Hartford Municipal Opportunities ETF,782900992.0,2026-07-08,yfinance,ok,2026-07-08T14:48:06Z,
AVTM,AVTM,Avantis Total Equity Markets ETF,778806784.0,2026-07-08,yfinance,ok,2026-07-08T14:39:28Z,
PFM,PFM,Invesco Dividend Achievers ETF,778581184.0,2026-07-08,yfinance,ok,2026-07-08T14:54:23Z,
PIZ,PIZ,Invesco Dorsey Wright Developed Markets Momentum ETF,776837824.0,2026-07-08,yfinance,ok,2026-07-08T14:54:32Z,
XONE,XONE,Bondbloxx Bloomberg One Year Target Duration US Treasury ETF,770892416.0,2026-07-08,yfinance,ok,2026-07-08T15:02:03Z,
SGVT,SGVT,Schwab Government Money Market ETF,769648128.0,2026-07-08,yfinance,ok,2026-07-08T14:57:17Z,
FLIA,FLIA,Franklin International Aggregate Bond ETF,767781568.0,2026-07-08,yfinance,ok,2026-07-08T14:45:44Z,
QQH,QQH,HCM Defender 100 Index ETF,766467648.0,2026-07-08,yfinance,ok,2026-07-08T14:55:34Z,
FLCA,FLCA,Franklin FTSE Canada ETF,766351808.0,2026-07-08,yfinance,ok,2026-07-08T14:45:39Z,
QQA,QQA,Invesco QQQ Income Advantage ETF,765760704.0,2026-07-08,yfinance,ok,2026-07-08T14:55:33Z,
IETC,IETC,iShares U.S. Tech Independence Focused ETF,762275200.0,2026-07-08,yfinance,ok,2026-07-08T14:49:01Z,
MSSM,MSSM,Morgan Stanley Pathway Small-Mid Cap Equity ETF,761760192.0,2026-07-08,yfinance,ok,2026-07-08T14:52:39Z,
VSDM,VSDM,Vanguard Short Duration Tax-Exe,759971200.0,2026-07-08,yfinance,ok,2026-07-08T15:01:04Z,
SCHQ,SCHQ,Schwab Long-Term U.S. Treasury ETF,759006400.0,2026-07-08,yfinance,ok,2026-07-08T14:56:53Z,
DBEU,DBEU,Xtrackers MSCI Europe Hedged Equity ETF,758183744.0,2026-07-08,yfinance,ok,2026-07-08T14:42:30Z,
EVSM,EVSM,Eaton Vance Short Duration Municipal Income ETF,758170496.0,2026-07-08,yfinance,ok,2026-07-08T14:44:34Z,
TUA,TUA,Simplify Short Term Treasury Futures Strategy ETF,751044800.0,2026-07-08,yfinance,ok,2026-07-08T14:59:51Z,
FETH,FETH,Fidelity Ethereum Fund,750931264.0,2026-07-08,yfinance,ok,2026-07-08T14:45:19Z,
CMDT,CMDT,PIMCO Commodity Strategy Active Exchange-Traded Fund,750605056.0,2026-07-08,yfinance,ok,2026-07-08T14:41:48Z,
GTOP,GTOP,Goldman Sachs Technology Opportunities ETF,749471552.0,2026-07-08,yfinance,ok,2026-07-08T14:47:35Z,
FEM,FEM,First Trust Emerging Markets AlphaDEX Fund,747033024.0,2026-07-08,yfinance,ok,2026-07-08T14:45:14Z,
DIV,DIV,Global X SuperDividend U.S. ETF,746963008.0,2026-07-08,yfinance,ok,2026-07-08T14:43:03Z,
BBSC,BBSC,JPMorgan BetaBuilders U.S. Small Cap Equity ETF,744330240.0,2026-07-08,yfinance,ok,2026-07-08T14:39:46Z,
XBIL,XBIL,F/m US Treasury 6 Month Bill ETF,739206080.0,2026-07-08,yfinance,ok,2026-07-08T15:01:41Z,
QDVO,QDVO,Amplify CWP Growth & Income ETF,738273024.0,2026-07-08,yfinance,ok,2026-07-08T14:55:23Z,
CPER,CPER,"United States Copper Index Fund, LP",737944704.0,2026-07-08,yfinance,ok,2026-07-08T14:41:59Z,
NANR,NANR,State Street SPDR S&P North American Natural Resources ETF,735533440.0,2026-07-08,yfinance,ok,2026-07-08T14:53:00Z,
FXR,FXR,First Trust Industrials/Producer Durables AlphaDEX Fund,733236544.0,2026-07-08,yfinance,ok,2026-07-08T14:46:39Z,
EWX,EWX,State Street SPDR S&P Emerging Markets Small Cap ETF,732866560.0,2026-07-08,yfinance,ok,2026-07-08T14:44:43Z,
EQL,EQL,ALPS Equal Sector Weight ETF,732600384.0,2026-07-08,yfinance,ok,2026-07-08T14:44:16Z,
CNEQ,CNEQ,Alger Concentrated Equity ETF,731520704.0,2026-07-08,yfinance,ok,2026-07-08T14:41:50Z,
ROBT,ROBT,First Trust Nasdaq Artificial Intelligence and Robotics ETF,729896320.0,2026-07-08,yfinance,ok,2026-07-08T14:56:19Z,
DBND,DBND,DoubleLine Opportunistic Core Bond ETF,728829568.0,2026-07-08,yfinance,ok,2026-07-08T14:42:32Z,
BFLX,BFLX,iShares Flexible Equity Active ETF,727234176.0,2026-07-08,yfinance,ok,2026-07-08T16:06:59Z,
ONEY,ONEY,State Street SPDR Russell 1000 Yield Focus ETF,726462336.0,2026-07-08,yfinance,ok,2026-07-08T14:53:49Z,
OUSA,OUSA,ALPS O'Shares U.S. Quality Dividend ETF Shares,725529600.0,2026-07-08,yfinance,ok,2026-07-08T14:53:54Z,
BRTR,BRTR,iShares Total Return Active ETF,725516224.0,2026-07-08,yfinance,ok,2026-07-08T14:40:39Z,
VLU,VLU,State Street SPDR S&P 1500 Value Tilt ETF,725514240.0,2026-07-08,yfinance,ok,2026-07-08T15:00:51Z,
HEWJ,HEWJ,iShares Currency Hedged MSCI Japan ETF,725120448.0,2026-07-08,yfinance,ok,2026-07-08T14:47:59Z,
EES,EES,WisdomTree U.S. SmallCap Earnings Fund,724324672.0,2026-07-08,yfinance,ok,2026-07-08T14:43:46Z,
ARKF,ARKF,ARK Blockchain & Fintech Innovation ETF,724075136.0,2026-07-08,yfinance,ok,2026-07-08T14:39:04Z,
YYY,YYY,Amplify CEF High Income ETF,721274560.0,2026-07-08,yfinance,ok,2026-07-08T15:02:23Z,
EUSB,EUSB,iShares ESG Advanced Universal USD Bond ETF,721004864.0,2026-07-08,yfinance,ok,2026-07-08T14:44:30Z,
LEMB,LEMB,iShares J.P. Morgan EM Local Currency Bond ETF,720280640.0,2026-07-08,yfinance,ok,2026-07-08T14:51:24Z,
EWJV,EWJV,iShares MSCI Japan Value ETF,719782464.0,2026-07-08,yfinance,ok,2026-07-08T14:44:38Z,
MINO,MINO,PIMCO Municipal Income Opportunities Active Exchange-Traded Fund,719776192.0,2026-07-08,yfinance,ok,2026-07-08T14:52:20Z,
SECU,SECU,iShares Securitized Income Active ETF,717394304.0,2026-07-08,yfinance,ok,2026-07-08T14:57:05Z,
GSPY,GSPY,Gotham Enhanced 500 ETF,715486656.0,2026-07-08,yfinance,ok,2026-07-08T14:47:31Z,
SKOR,SKOR,FlexShares Credit-Scored US Corporate Bond Index Fund,715250368.0,2026-07-08,yfinance,ok,2026-07-08T14:57:31Z,
SPEU,SPEU,State Street SPDR Portfolio Europe ETF,713144960.0,2026-07-08,yfinance,ok,2026-07-08T14:58:00Z,
DFSB,DFSB,Dimensional Global Sustainability Fixed Income ETF,713070656.0,2026-07-08,yfinance,ok,2026-07-08T14:42:52Z,
XTL,XTL,State Street SPDR S&P Telecom ETF,712182528.0,2026-07-08,yfinance,ok,2026-07-08T15:02:13Z,
JDVI,JDVI,John Hancock Disciplined Value International Select ETF,709201472.0,2026-07-08,yfinance,ok,2026-07-08T14:50:20Z,
FDRR,FDRR,Fidelity Dividend ETF for Rising Rates,708795392.0,2026-07-08,yfinance,ok,2026-07-08T14:45:07Z,
LTPZ,LTPZ,PIMCO 15+ Year U.S. TIPS Index Exchange-Traded Fund,707930688.0,2026-07-08,yfinance,ok,2026-07-08T14:51:45Z,
IGE,IGE,iShares North American Natural Resources ETF,707904256.0,2026-07-08,yfinance,ok,2026-07-08T14:49:06Z,
PSK,PSK,State Street SPDR ICE Preferred Securities ETF,707818752.0,2026-07-08,yfinance,ok,2026-07-08T14:54:58Z,
HEGD,HEGD,Swan Hedged Equity US Large Cap ETF,707129216.0,2026-07-08,yfinance,ok,2026-07-08T14:47:55Z,
CAOS,CAOS,Alpha Architect Tail Risk ETF,705090432.0,2026-07-08,yfinance,ok,2026-07-08T14:41:10Z,
DMBS,DMBS,Doubleline Etf Trust - Mortgage ETF,704881280.0,2026-07-08,yfinance,ok,2026-07-08T14:43:08Z,
RSPH,RSPH,Invesco S&P 500 Equal Weight Health Care ETF,704804992.0,2026-07-08,yfinance,ok,2026-07-08T14:56:28Z,
VFMF,VFMF,Vanguard U.S. Multifactor ETF Shares,703166400.0,2026-07-08,yfinance,ok,2026-07-08T15:00:43Z,
DFCA,DFCA,Dimensional California Municipal Bond ETF,703116160.0,2026-07-08,yfinance,ok,2026-07-08T14:42:46Z,
BSJS,BSJS,Invesco BulletShares 2028 High Yield Corporate Bond ETF,702697984.0,2026-07-08,yfinance,ok,2026-07-08T14:40:45Z,
MLN,MLN,VanEck Long Muni ETF,700391296.0,2026-07-08,yfinance,ok,2026-07-08T14:52:24Z,
OSCV,OSCV,Opus Small Cap Value Plus ETF,698847104.0,2026-07-08,yfinance,ok,2026-07-08T14:53:52Z,
NUDM,NUDM,Nuveen ESG International Developed Markets Equity ETF,698256320.0,2026-07-08,yfinance,ok,2026-07-08T14:53:23Z,
SMIN,SMIN,iShares MSCI India Small-Cap ETF,697300928.0,2026-07-08,yfinance,ok,2026-07-08T14:57:42Z,
IQDG,IQDG,WisdomTree International Quality Dividend Growth Fund,695486016.0,2026-07-08,yfinance,ok,2026-07-08T14:49:36Z,
SMDV,SMDV,ProShares Russell 2000 Dividend Growers ETF,695106560.0,2026-07-08,yfinance,ok,2026-07-08T14:57:40Z,
CLOZ,CLOZ,Eldridge BBB-B CLO ETF,692161408.0,2026-07-08,yfinance,ok,2026-07-08T14:41:46Z,
XCHG,XCHG,Ab US Equity ETF,692004032.0,2026-07-08,yfinance,ok,2026-07-08T15:01:43Z,
VUSE,VUSE,Vident U.S. Equity Strategy ETF,690218688.0,2026-07-08,yfinance,ok,2026-07-08T15:01:12Z,
PGF,PGF,Invesco Financial Preferred ETF,689249344.0,2026-07-08,yfinance,ok,2026-07-08T14:54:24Z,
JHSC,JHSC,John Hancock Multifactor Small Cap ETF,687356736.0,2026-07-08,yfinance,ok,2026-07-08T14:50:31Z,
ISCV,ISCV,iShares Morningstar Small-Cap Value ETF,685244224.0,2026-07-08,yfinance,ok,2026-07-08T14:49:42Z,
FEPI,FEPI,REX FANG & Innovation Equity Premium Income ETF,683570816.0,2026-07-08,yfinance,ok,2026-07-08T14:45:18Z,
TAXF,TAXF,American Century Diversified Municipal Bond ETF,681364992.0,2026-07-08,yfinance,ok,2026-07-08T14:58:41Z,
EPOL,EPOL,iShares MSCI Poland ETF,679157888.0,2026-07-08,yfinance,ok,2026-07-08T14:44:13Z,
CTEF,CTEF,Castellan Targeted Equity ETF,678458432.0,2026-07-08,yfinance,ok,2026-07-08T14:42:18Z,
MLPI,MLPI,Neos Mlp & Energy Infrastructure High Income ETF,675805824.0,2026-07-08,yfinance,ok,2026-07-08T14:52:24Z,
QINT,QINT,American Century Quality Diversified International ETF,673497472.0,2026-07-08,yfinance,ok,2026-07-08T14:55:28Z,
TAFM,TAFM,AB Tax-Aware Intermediate Municipal ETF,672893120.0,2026-07-08,yfinance,ok,2026-07-08T14:58:38Z,
AVMV,AVMV,Avantis U.S. Mid Cap Value ETF,672494464.0,2026-07-08,yfinance,ok,2026-07-08T14:39:24Z,
BRES,BRES,Burney U.S. Equity Select ETF,672220352.0,2026-07-08,yfinance,ok,2026-07-08T14:40:35Z,
EMEQ,EMEQ,Nomura Focused Emerging Markets Equity ETF,672161920.0,2026-07-08,yfinance,ok,2026-07-08T14:44:00Z,
BKMC,BKMC,BNY Mellon US Mid Cap Core Equity ETF,670144192.0,2026-07-08,yfinance,ok,2026-07-08T14:40:18Z,
DBJP,DBJP,Xtrackers MSCI Japan Hedged Equity ETF,670068032.0,2026-07-08,yfinance,ok,2026-07-08T14:42:31Z,
SFY,SFY,SoFi Select 500 ETF,669905472.0,2026-07-08,yfinance,ok,2026-07-08T14:57:13Z,
WTAI,WTAI,WisdomTree Artificial Intelligence and Innovation Fund,669490368.0,2026-07-08,yfinance,ok,2026-07-08T15:01:34Z,
ROUS,ROUS,Hartford Multifactor US Equity ETF,668653760.0,2026-07-08,yfinance,ok,2026-07-08T14:56:22Z,
AVNM,AVNM,Avantis All International Markets Equity ETF,666446784.0,2026-07-08,yfinance,ok,2026-07-08T14:39:24Z,
AVSF,AVSF,Avantis Short-Term Fixed Income ETF,663844032.0,2026-07-08,yfinance,ok,2026-07-08T14:39:27Z,
SEIQ,SEIQ,SEI QiM U.S. Large Cap Quality Active ETF,663754176.0,2026-07-08,yfinance,ok,2026-07-08T14:57:07Z,
DWM,DWM,WisdomTree International Equity Fund,662622592.0,2026-07-08,yfinance,ok,2026-07-08T14:43:28Z,
EBI,EBI,Longview Advantage ETF,661948864.0,2026-07-08,yfinance,ok,2026-07-08T14:43:36Z,
AFLG,AFLG,First Trust Active Factor Large Cap ETF,659596928.0,2026-07-08,yfinance,ok,2026-07-08T14:38:29Z,
FIIG,FIIG,First Trust Intermediate Duration Investment Grade Corporate ETF,659412608.0,2026-07-08,yfinance,ok,2026-07-08T14:45:31Z,
TOPT,TOPT,iShares Top 20 U.S. Stocks ETF,657249344.0,2026-07-08,yfinance,ok,2026-07-08T14:59:29Z,
IAT,IAT,iShares U.S. Regional Banks ETF,656003968.0,2026-07-08,yfinance,ok,2026-07-08T14:48:25Z,
IBMQ,IBMQ,iShares iBonds Dec 2028 Term Muni Bond ETF,652935104.0,2026-07-08,yfinance,ok,2026-07-08T14:48:42Z,
LGOV,LGOV,First Trust Long Duration Opportunities ETF,652274048.0,2026-07-08,yfinance,ok,2026-07-08T14:51:29Z,
NPFE,NPFE,NPF Core Equity ETF,652094656.0,2026-07-08,yfinance,ok,2026-07-08T14:53:18Z,
XSVM,XSVM,Invesco S&P SmallCap Value with Momentum ETF,651285248.0,2026-07-08,yfinance,ok,2026-07-08T15:02:10Z,
KAT,KAT,Scharf ETF,650913984.0,2026-07-08,yfinance,ok,2026-07-08T14:50:53Z,
FYLD,FYLD,Cambria Foreign Shareholder Yield ETF,650866496.0,2026-07-08,yfinance,ok,2026-07-08T14:46:41Z,
KSA,KSA,iShares MSCI Saudi Arabia ETF,649784384.0,2026-07-08,yfinance,ok,2026-07-08T14:51:10Z,
TFLR,TFLR,T. Rowe Price Floating Rate ETF,649046976.0,2026-07-08,yfinance,ok,2026-07-08T14:59:01Z,
TLTD,TLTD,FlexShares Morningstar Developed Markets ex-US Factor Tilt Index Fund,646691904.0,2026-07-08,yfinance,ok,2026-07-08T14:59:18Z,
PMMF,PMMF,iShares Prime Money Market ETF,646035584.0,2026-07-08,yfinance,ok,2026-07-08T14:54:38Z,
SLVR,SLVR,Sprott Silver Miners & Physical Silver ETF,645818880.0,2026-07-08,yfinance,ok,2026-07-08T14:57:33Z,
XVV,XVV,iShares ESG Select Screened S&P 500 ETF,644896256.0,2026-07-08,yfinance,ok,2026-07-08T15:02:17Z,
PRN,PRN,Invesco Dorsey Wright Industrials Momentum ETF,644142400.0,2026-07-08,yfinance,ok,2026-07-08T14:54:46Z,
IBMP,IBMP,iShares iBonds Dec 2027 Term Muni Bond ETF,642710784.0,2026-07-08,yfinance,ok,2026-07-08T14:48:41Z,
HNDL,HNDL,Strategy Shares Nasdaq 7 Handl Index ETF,641297472.0,2026-07-08,yfinance,ok,2026-07-08T14:48:06Z,
ISCF,ISCF,iShares MSCI Intl Small-Cap Multifactor ETF,639879616.0,2026-07-08,yfinance,ok,2026-07-08T14:49:42Z,
LSVD,LSVD,LSV Disciplined Value ETF,639797440.0,2026-07-08,yfinance,ok,2026-07-08T14:51:44Z,
SPSK,SPSK,SP Funds Dow Jones Global Sukuk ETF,638180672.0,2026-07-08,yfinance,ok,2026-07-08T14:58:07Z,
MYCH,MYCH,State Street My2028 Corporate Bond ETF,635688192.0,2026-07-08,yfinance,ok,2026-07-08T14:52:52Z,
FLRT,FLRT,Pacer Aristotle Pacific Floating Rate High Income ETF,628724864.0,2026-07-08,yfinance,ok,2026-07-08T14:45:51Z,
GXUS,GXUS,Goldman Sachs MarketBeta(R) Total International Equity ETF,626589120.0,2026-07-08,yfinance,ok,2026-07-08T14:47:44Z,
FSMB,FSMB,First Trust Short Duration Managed Municipal ETF,626040128.0,2026-07-08,yfinance,ok,2026-07-08T14:46:16Z,
ILTB,ILTB,iShares Core 10+ Year USD Bond ETF,625408448.0,2026-07-08,yfinance,ok,2026-07-08T14:49:20Z,
DTH,DTH,WisdomTree International High Dividend Fund,623800512.0,2026-07-08,yfinance,ok,2026-07-08T14:43:19Z,
FMAT,FMAT,Fidelity MSCI Materials Index ETF,623540800.0,2026-07-08,yfinance,ok,2026-07-08T14:45:55Z,
HCMT,HCMT,Direxion HCM Tactical Enhanced U.S. Equity Strategy ETF,621759104.0,2026-07-08,yfinance,ok,2026-07-08T14:47:50Z,
PCS,PCS,PGIM Corporate Bond 0-5 Year ETF,618536256.0,2026-07-08,yfinance,ok,2026-07-08T14:54:14Z,
DGT,DGT,State Street SPDR Global Dow ETF,617911040.0,2026-07-08,yfinance,ok,2026-07-08T14:42:58Z,
DFSE,DFSE,Dimensional Emerging Markets Sustainability Core 1 ETF,615862848.0,2026-07-08,yfinance,ok,2026-07-08T14:42:52Z,
FNY,FNY,First Trust Mid Cap Growth AlphaDEX Fund,614864384.0,2026-07-08,yfinance,ok,2026-07-08T14:46:04Z,
BBHY,BBHY,JPMorgan BetaBuilders USD High Yield Corporate Bond ETF,610806592.0,2026-07-08,yfinance,ok,2026-07-08T14:39:42Z,
EMHY,EMHY,iShares J.P. Morgan EM High Yield Bond ETF,607238400.0,2026-07-08,yfinance,ok,2026-07-08T14:44:02Z,
SFLO,SFLO,Victoryshares Small Cap Free Cash Flow ETF,606410432.0,2026-07-08,yfinance,ok,2026-07-08T14:57:11Z,
SEEM,SEEM,SEI Select Emerging Markets Equity ETF,605732608.0,2026-07-08,yfinance,ok,2026-07-08T14:57:05Z,
MUST,MUST,Columbia Multi-Sector Municipal Income ETF,602205888.0,2026-07-08,yfinance,ok,2026-07-08T14:52:48Z,
GVIP,GVIP,Goldman Sachs Hedge Industry VIP ETF,598637376.0,2026-07-08,yfinance,ok,2026-07-08T14:47:38Z,
RAA,RAA,SMI 3Fourteen REAL Asset Allocation ETF,595158976.0,2026-07-08,yfinance,ok,2026-07-08T14:55:50Z,
PBEU,PBEU,Portfolio Building Block European Banks Index ETF,594092160.0,2026-07-08,yfinance,ok,2026-07-08T14:54:05Z,
BSOL,BSOL,Bitwise Solana Staking ETF,593902208.0,2026-07-08,yfinance,ok,2026-07-08T15:29:10Z,
JPSE,JPSE,JPMorgan Diversified Return U.S. Small Cap Equity ETF,593730816.0,2026-07-08,yfinance,ok,2026-07-08T14:50:42Z,
FTRB,FTRB,Federated Hermes Total Return Bond ETF,592248640.0,2026-07-08,yfinance,ok,2026-07-08T14:46:28Z,
PALL,PALL,abrdn Physical Palladium Shares ETF,591084800.0,2026-07-08,yfinance,ok,2026-07-08T14:54:01Z,
SMRI,SMRI,Bushido Capital US Equity ETF,590741120.0,2026-07-08,yfinance,ok,2026-07-08T14:57:47Z,
FCG,FCG,First Trust Natural Gas ETF,589664512.0,2026-07-08,yfinance,ok,2026-07-08T14:44:56Z,
FDEM,FDEM,Fidelity Emerging Markets Multifactor ETF,587022400.0,2026-07-08,yfinance,ok,2026-07-08T14:45:01Z,
FLCO,FLCO,Franklin Investment Grade Corporate ETF,586547520.0,2026-07-08,yfinance,ok,2026-07-08T14:45:41Z,
RPAR,RPAR,RPAR Risk Parity ETF,586026496.0,2026-07-08,yfinance,ok,2026-07-08T14:56:22Z,
IXG,IXG,iShares Global Financials ETF,585764608.0,2026-07-08,yfinance,ok,2026-07-08T14:50:05Z,
IBMO,IBMO,iShares iBonds Dec 2026 Term Muni Bond ETF,585047424.0,2026-07-08,yfinance,ok,2026-07-08T14:48:41Z,
HEZU,HEZU,iShares Currency Hedged MSCI Eurozone ETF,584931072.0,2026-07-08,yfinance,ok,2026-07-08T14:47:59Z,
SCEC,SCEC,Sterling Capital Enhanced Core Bond ETF,584808064.0,2026-07-08,yfinance,ok,2026-07-08T14:56:47Z,
PSCT,PSCT,Invesco S&P SmallCap Information Technology ETF,584721216.0,2026-07-08,yfinance,ok,2026-07-08T14:54:53Z,
PSFF,PSFF,Pacer Swan SOS Fund of Funds ETF,584181696.0,2026-07-08,yfinance,ok,2026-07-08T14:54:56Z,
BRNY,BRNY,Burney U.S. Factor Rotation ETF,583867200.0,2026-07-08,yfinance,ok,2026-07-08T14:40:38Z,
SEIS,SEIS,SEI Select Small Cap ETF,581771200.0,2026-07-08,yfinance,ok,2026-07-08T14:57:07Z,
SSUS,SSUS,Day Hagan Smart Sector ETF,581155904.0,2026-07-08,yfinance,ok,2026-07-08T14:58:22Z,
LGH,LGH,HCM Defender 500 Index ETF,580633920.0,2026-07-08,yfinance,ok,2026-07-08T14:51:28Z,
FAD,FAD,First Trust Multi Cap Growth AlphaDEX Fund,579926400.0,2026-07-08,yfinance,ok,2026-07-08T14:44:50Z,
TOTR,TOTR,T. Rowe Price Total Return ETF,579120256.0,2026-07-08,yfinance,ok,2026-07-08T14:59:30Z,
ELM,ELM,Elm Market Navigator ETF,577851456.0,2026-07-08,yfinance,ok,2026-07-08T14:43:57Z,
IBTL,IBTL,iShares iBonds Dec 2031 Term Treasury ETF,575821696.0,2026-07-08,yfinance,ok,2026-07-08T14:48:47Z,
SETM,SETM,Sprott Critical Materials ETF,574871488.0,2026-07-08,yfinance,ok,2026-07-08T14:57:11Z,
AQEC,AQEC,AQE Core ETF,574481152.0,2026-07-08,yfinance,ok,2026-07-08T14:39:01Z,
USSG,USSG,Xtrackers MSCI USA Selection Equity ETF,574231424.0,2026-07-08,yfinance,ok,2026-07-08T15:00:19Z,
LONZ,LONZ,PIMCO Senior Loan Active Exchange-Traded Fund,574010368.0,2026-07-08,yfinance,ok,2026-07-08T14:51:35Z,
YLD,YLD,Principal Active High Yield ETF,572786432.0,2026-07-08,yfinance,ok,2026-07-08T15:02:21Z,
HYBL,HYBL,State Street Blackstone High Income ETF,569136512.0,2026-07-08,yfinance,ok,2026-07-08T14:48:14Z,
DWLD,DWLD,Davis Select Worldwide ETF,567968768.0,2026-07-08,yfinance,ok,2026-07-08T14:43:28Z,
BLUX,BLUX,Bluemonte Dynamic Total Market ETF,567631168.0,2026-07-08,yfinance,ok,2026-07-08T14:40:24Z,
VNM,VNM,VanEck Vietnam ETF,564503872.0,2026-07-08,yfinance,ok,2026-07-08T15:00:54Z,
NXTG,NXTG,First Trust IndXX NextG ETF,563929472.0,2026-07-08,yfinance,ok,2026-07-08T14:53:33Z,
BSCY,BSCY,Invesco BulletShares 2034 Corporate Bond ETF,563020864.0,2026-07-08,yfinance,ok,2026-07-08T14:40:43Z,
GQGU,GQGU,GQG US Equity ETF,560850176.0,2026-07-08,yfinance,ok,2026-07-08T14:47:21Z,
FIVA,FIVA,Fidelity International Value Factor ETF,560078272.0,2026-07-08,yfinance,ok,2026-07-08T14:45:34Z,
SGDM,SGDM,Sprott Gold Miners ETF,558742656.0,2026-07-08,yfinance,ok,2026-07-08T14:57:14Z,
FLCG,FLCG,Federated Hermes MDT Large Cap Growth ETF,558741888.0,2026-07-08,yfinance,ok,2026-07-08T14:45:40Z,
EWN,EWN,iShares MSCI Netherlands ETF,558613440.0,2026-07-08,yfinance,ok,2026-07-08T14:44:39Z,
INDY,INDY,iShares India 50 ETF,557996544.0,2026-07-08,yfinance,ok,2026-07-08T14:49:27Z,
SIXH,SIXH,ETC 6 Meridian Hedged Equity-Index Option Strategy ETF,556023232.0,2026-07-08,yfinance,ok,2026-07-08T14:57:27Z,
AGZ,AGZ,iShares Agency Bond ETF,555886400.0,2026-07-08,yfinance,ok,2026-07-08T14:38:36Z,
JUST,JUST,Goldman Sachs JUST U.S. Large Cap Equity ETF,554671680.0,2026-07-08,yfinance,ok,2026-07-08T14:50:51Z,
RSPU,RSPU,Invesco S&P 500 Equal Weight Utilities ETF,553843520.0,2026-07-08,yfinance,ok,2026-07-08T14:56:30Z,
