symbol,yf_symbol,name,aum,aum_date,source,status,last_checked,error
VTI,VTI,Vanguard Total Stock Market Index Fund ETF Shares,2297940410368.0,2026-07-08,yfinance,ok,2026-07-08T15:01:09Z,
VOO,VOO,Vanguard S&P 500 ETF,1670882131968.0,2026-07-08,yfinance,ok,2026-07-08T15:00:57Z,
IVV,IVV,iShares Core S&P 500 ETF,888128929792.0,2026-07-08,yfinance,ok,2026-07-08T14:49:57Z,
SPY,SPY,State Street SPDR S&P 500 ETF Trust,781188857856.0,2026-07-08,yfinance,ok,2026-07-08T14:58:13Z,
VXUS,VXUS,Vanguard Total International Stock Index Fund ETF Shares,650318381056.0,2026-07-08,yfinance,ok,2026-07-08T15:01:15Z,
QQQ,QQQ,Invesco QQQ Trust,490103177216.0,2026-07-08,yfinance,ok,2026-07-08T14:55:35Z,
BND,BND,Vanguard Total Bond Market Index Fund,397862928384.0,2026-07-08,yfinance,ok,2026-07-08T14:40:26Z,
VUG,VUG,Vanguard Growth Index Fund ETF Shares,379207221248.0,2026-07-08,yfinance,ok,2026-07-08T15:01:12Z,
VEA,VEA,Vanguard FTSE Developed Markets Index Fund ETF Shares,316309798912.0,2026-07-08,yfinance,ok,2026-07-08T15:00:39Z,
VTV,VTV,Vanguard Value Index Fund ETF Shares,254461837312.0,2026-07-08,yfinance,ok,2026-07-08T15:01:10Z,
VO,VO,Vanguard Mid-Cap Index Fund ETF Shares,223974162432.0,2026-07-08,yfinance,ok,2026-07-08T15:00:55Z,
VB,VB,Vanguard Small-Cap Index Fund ETF Shares,188574482432.0,2026-07-08,yfinance,ok,2026-07-08T15:00:28Z,
IEFA,IEFA,iShares Core MSCI EAFE ETF,186543423488.0,2026-07-08,yfinance,ok,2026-07-08T14:48:59Z,
VGT,VGT,Vanguard Information Technology Index Fund ETF Shares,169247817728.0,2026-07-08,yfinance,ok,2026-07-08T15:00:47Z,
VWO,VWO,Vanguard Emerging Markets Stock Index Fund,163324018688.0,2026-07-08,yfinance,ok,2026-07-08T15:01:14Z,
IEMG,IEMG,iShares Core MSCI Emerging Markets ETF,160718422016.0,2026-07-08,yfinance,ok,2026-07-08T14:49:01Z,
SPYM,SPYM,State Street SPDR Portfolio S&P 500 ETF,153918701568.0,2026-07-08,yfinance,ok,2026-07-08T14:58:15Z,
AGG,AGG,iShares Core U.S. Aggregate Bond ETF,138847469568.0,2026-07-08,yfinance,ok,2026-07-08T14:38:32Z,
GLD,GLD,SPDR Gold Shares,130053275648.0,2026-07-08,yfinance,ok,2026-07-08T14:47:06Z,
VIG,VIG,Vanguard Dividend Appreciation Index Fund ETF Shares,129462992896.0,2026-07-08,yfinance,ok,2026-07-08T15:00:49Z,
IWF,IWF,iShares Russell 1000 Growth ETF,128899137536.0,2026-07-08,yfinance,ok,2026-07-08T14:50:00Z,
IJH,IJH,iShares Core S&P Mid-Cap ETF,124330491904.0,2026-07-08,yfinance,ok,2026-07-08T14:49:15Z,
XLK,XLK,State Street Technology Select Sector SPDR ETF,123912577024.0,2026-07-08,yfinance,ok,2026-07-08T15:01:55Z,
BNDX,BNDX,Vanguard Total International Bond Index Fund,123285929984.0,2026-07-08,yfinance,ok,2026-07-08T14:40:28Z,
IJR,IJR,iShares Core S&P Small-Cap ETF,111317172224.0,2026-07-08,yfinance,ok,2026-07-08T14:49:16Z,
QQQM,QQQM,Invesco NASDAQ 100 ETF,101307228160.0,2026-07-08,yfinance,ok,2026-07-08T14:55:38Z,
VXF,VXF,Vanguard Extended Market Index Fund ETF Shares,97684774912.0,2026-07-08,yfinance,ok,2026-07-08T15:01:14Z,
VT,VT,Vanguard Total World Stock Index Fund ETF Shares,96774266880.0,2026-07-08,yfinance,ok,2026-07-08T15:01:06Z,
VYM,VYM,Vanguard High Dividend Yield Index Fund ETF Shares,96168181760.0,2026-07-08,yfinance,ok,2026-07-08T15:01:15Z,
SGOV,SGOV,iShares 0-3 Month Treasury Bond ETF,95892447232.0,2026-07-08,yfinance,ok,2026-07-08T14:57:15Z,
SCHD,SCHD,Schwab U.S. Dividend Equity ETF,95734071296.0,2026-07-08,yfinance,ok,2026-07-08T14:56:49Z,
VEU,VEU,Vanguard FTSE All-World ex-US Index Fund ETF Shares,94563958784.0,2026-07-08,yfinance,ok,2026-07-08T15:00:42Z,
ITOT,ITOT,iShares Core S&P Total U.S. Stock Market ETF,94139031552.0,2026-07-08,yfinance,ok,2026-07-08T14:49:51Z,
RSP,RSP,Invesco S&P 500 Equal Weight ETF,93655826432.0,2026-07-08,yfinance,ok,2026-07-08T14:56:26Z,
IWM,IWM,iShares Russell 2000 ETF,82970353664.0,2026-07-08,yfinance,ok,2026-07-08T14:50:01Z,
IWD,IWD,iShares Russell 1000 Value ETF,79741509632.0,2026-07-08,yfinance,ok,2026-07-08T14:49:59Z,
EFA,EFA,iShares MSCI EAFE ETF,77217693696.0,2026-07-08,yfinance,ok,2026-07-08T14:43:47Z,
SMH,SMH,VanEck Semiconductor ETF,77198270464.0,2026-07-08,yfinance,ok,2026-07-08T14:57:41Z,
IVW,IVW,iShares S&P 500 Growth ETF,74972356608.0,2026-07-08,yfinance,ok,2026-07-08T14:49:58Z,
VV,VV,Vanguard Large Cap Index Fund,73819176960.0,2026-07-08,yfinance,ok,2026-07-08T15:01:13Z,
SCHX,SCHX,Schwab U.S. Large-Cap ETF,71641505792.0,2026-07-08,yfinance,ok,2026-07-08T14:56:54Z,
VNQ,VNQ,Vanguard Real Estate Index Fund ETF Shares,71348019200.0,2026-07-08,yfinance,ok,2026-07-08T15:00:54Z,
VTIP,VTIP,Vanguard Short-Term Inflation-Protected Securities Index Fund ETF Shares,71082704896.0,2026-07-08,yfinance,ok,2026-07-08T15:01:09Z,
BSV,BSV,Vanguard Short-Term Bond Index Fund ETF Shares,69833809920.0,2026-07-08,yfinance,ok,2026-07-08T14:40:53Z,
VCIT,VCIT,Vanguard Intermediate-Term Corporate Bond Index Fund ETF Shares,69441978368.0,2026-07-08,yfinance,ok,2026-07-08T15:00:34Z,
VBR,VBR,Vanguard Small-Cap Value Index Fund ETF Shares,67781795840.0,2026-07-08,yfinance,ok,2026-07-08T15:00:33Z,
SCHF,SCHF,Schwab International Equity ETF,66217533440.0,2026-07-08,yfinance,ok,2026-07-08T14:56:50Z,
IAU,IAU,iShares Gold Trust,60138172416.0,2026-07-08,yfinance,ok,2026-07-08T14:48:26Z,
SCHG,SCHG,Schwab U.S. Large-Cap Growth ETF,59069509632.0,2026-07-08,yfinance,ok,2026-07-08T14:56:50Z,
IXUS,IXUS,iShares Core MSCI Total International Stock ETF,58515161088.0,2026-07-08,yfinance,ok,2026-07-08T14:50:07Z,
IWR,IWR,iShares Russell Mid-Cap ETF,56977440768.0,2026-07-08,yfinance,ok,2026-07-08T14:50:03Z,
VONG,VONG,Vanguard Russell 1000 Growth Index Fund ETF Shares,53361160192.0,2026-07-08,yfinance,ok,2026-07-08T15:00:57Z,
SPYG,SPYG,State Street SPDR Portfolio S&P 500 Growth ETF,52988604416.0,2026-07-08,yfinance,ok,2026-07-08T14:58:14Z,
BIV,BIV,Vanguard Intermediate-Term Bond Index Fund,52510502912.0,2026-07-08,yfinance,ok,2026-07-08T14:40:12Z,
VCSH,VCSH,Vanguard Short-Term Corporate Bond Index Fund ETF Shares,51786543104.0,2026-07-08,yfinance,ok,2026-07-08T15:00:36Z,
XLF,XLF,State Street Financial Select Sector SPDR ETF,51353821184.0,2026-07-08,yfinance,ok,2026-07-08T15:01:53Z,
VGIT,VGIT,Vanguard Intermediate-Term Treasury Index Fund ETF Shares,50384760832.0,2026-07-08,yfinance,ok,2026-07-08T15:00:45Z,
VTEB,VTEB,Vanguard Tax-Exempt Bond Index Fund ETF Shares,48785248256.0,2026-07-08,yfinance,ok,2026-07-08T15:01:06Z,
IWB,IWB,iShares Russell 1000 ETF,48330235904.0,2026-07-08,yfinance,ok,2026-07-08T14:49:59Z,
SOXX,SOXX,iShares Semiconductor ETF,47824830464.0,2026-07-08,yfinance,ok,2026-07-08T14:57:53Z,
IVE,IVE,iShares S&P 500 Value ETF,47735062528.0,2026-07-08,yfinance,ok,2026-07-08T14:49:53Z,
DFAC,DFAC,Dimensional U.S. Core Equity 2 ETF,47398703104.0,2026-07-08,yfinance,ok,2026-07-08T14:42:42Z,
IEF,IEF,iShares 7-10 Year Treasury Bond ETF,47093366784.0,2026-07-08,yfinance,ok,2026-07-08T14:48:59Z,
BIL,BIL,State Street SPDR Bloomberg 1-3 Month T-Bill ETF,47077847040.0,2026-07-08,yfinance,ok,2026-07-08T14:40:07Z,
VBK,VBK,Vanguard Small-Cap Growth Index Fund ETF Shares,47006371840.0,2026-07-08,yfinance,ok,2026-07-08T15:00:32Z,
QUAL,QUAL,iShares MSCI USA Quality Factor ETF,45917487104.0,2026-07-08,yfinance,ok,2026-07-08T14:55:46Z,
MUB,MUB,iShares National Muni Bond ETF,45820870656.0,2026-07-08,yfinance,ok,2026-07-08T14:52:43Z,
JEPI,JEPI,JPMorgan Equity Premium Income ETF,44746088448.0,2026-07-08,yfinance,ok,2026-07-08T14:50:22Z,
DIA,DIA,State Street SPDR Dow Jones Industrial Average ETF Trust,44062826496.0,2026-07-08,yfinance,ok,2026-07-08T14:42:59Z,
GOVT,GOVT,iShares U.S. Treasury Bond ETF,43729891328.0,2026-07-08,yfinance,ok,2026-07-08T14:47:18Z,
IBIT,IBIT,iShares Bitcoin Trust ETF,43234205696.0,2026-07-08,yfinance,ok,2026-07-08T14:48:40Z,
SCHB,SCHB,Schwab U.S. Broad Market ETF,43229065216.0,2026-07-08,yfinance,ok,2026-07-08T14:56:48Z,
IUSB,IUSB,iShares Core Universal USD Bond ETF,42765500416.0,2026-07-08,yfinance,ok,2026-07-08T14:49:52Z,
DGRO,DGRO,iShares Core Dividend Growth ETF,41227829248.0,2026-07-08,yfinance,ok,2026-07-08T14:42:56Z,
TLT,TLT,iShares 20+ Year Treasury Bond ETF,41099935744.0,2026-07-08,yfinance,ok,2026-07-08T14:59:17Z,
JEPQ,JEPQ,JPMorgan Nasdaq Equity Premium Income ETF,40656678912.0,2026-07-08,yfinance,ok,2026-07-08T14:50:22Z,
XLV,XLV,State Street Health Care Select Sector SPDR ETF,40598945792.0,2026-07-08,yfinance,ok,2026-07-08T15:01:58Z,
SPDW,SPDW,State Street SPDR Portfolio Developed World ex-US ETF,40294080512.0,2026-07-08,yfinance,ok,2026-07-08T14:57:59Z,
MBB,MBB,iShares MBS ETF,39630225408.0,2026-07-08,yfinance,ok,2026-07-08T14:51:55Z,
DYNF,DYNF,iShares U.S. Equity Factor Rotation Active ETF,38004244480.0,2026-07-08,yfinance,ok,2026-07-08T14:43:32Z,
VGK,VGK,Vanguard FTSE Europe ETF,37858430976.0,2026-07-08,yfinance,ok,2026-07-08T15:00:45Z,
VOE,VOE,Vanguard Mid-Cap Value Index Fund ETF Shares,37230292992.0,2026-07-08,yfinance,ok,2026-07-08T15:00:56Z,
CGDV,CGDV,Capital Group Dividend Value ETF,37159641088.0,2026-07-08,yfinance,ok,2026-07-08T14:41:29Z,
XLE,XLE,State Street Energy Select Sector SPDR ETF,35721338880.0,2026-07-08,yfinance,ok,2026-07-08T15:01:53Z,
SPYV,SPYV,State Street SPDR Portfolio S&P 500 Value ETF,35300089856.0,2026-07-08,yfinance,ok,2026-07-08T14:58:16Z,
VOT,VOT,Vanguard Mid-Cap Growth Index Fund ETF Shares,34797047808.0,2026-07-08,yfinance,ok,2026-07-08T15:00:59Z,
XLI,XLI,State Street Industrial Select Sector SPDR ETF,33963890688.0,2026-07-08,yfinance,ok,2026-07-08T15:01:55Z,
VGSH,VGSH,Vanguard Short-Term Treasury Index Fund ETF Shares,33827600384.0,2026-07-08,yfinance,ok,2026-07-08T15:00:47Z,
MGK,MGK,Vanguard Mega Cap Growth Index Fund,33301635072.0,2026-07-08,yfinance,ok,2026-07-08T14:52:14Z,
ACWI,ACWI,iShares MSCI ACWI ETF,33203742720.0,2026-07-08,yfinance,ok,2026-07-08T14:38:23Z,
LQD,LQD,iShares iBoxx $ Investment Grade Corporate Bond ETF,33113137152.0,2026-07-08,yfinance,ok,2026-07-08T14:51:38Z,
IUSG,IUSG,iShares Core S&P U.S. Growth ETF,32221673472.0,2026-07-08,yfinance,ok,2026-07-08T14:49:52Z,
IDEV,IDEV,iShares Core MSCI International Developed Markets ETF,30637815808.0,2026-07-08,yfinance,ok,2026-07-08T14:48:53Z,
EEM,EEM,iShares MSCI Emerging Markets ETF,30315917312.0,2026-07-08,yfinance,ok,2026-07-08T14:43:44Z,
AVUV,AVUV,Avantis US Small Cap Value ETF,29055420416.0,2026-07-08,yfinance,ok,2026-07-08T14:39:29Z,
MTUM,MTUM,iShares MSCI USA Momentum Factor ETF,29047369728.0,2026-07-08,yfinance,ok,2026-07-08T14:52:43Z,
USHY,USHY,iShares Broad USD High Yield Corporate Bond ETF,28476405760.0,2026-07-08,yfinance,ok,2026-07-08T15:00:13Z,
JAAA,JAAA,Janus Henderson AAA CLO ETF,28412567552.0,2026-07-08,yfinance,ok,2026-07-08T14:50:13Z,
SLV,SLV,iShares Silver Trust,28194189312.0,2026-07-08,yfinance,ok,2026-07-08T14:57:32Z,
MDY,MDY,State Street SPDR S&P MIDCAP 400 ETF Trust,28052918272.0,2026-07-08,yfinance,ok,2026-07-08T14:52:03Z,
GLDM,GLDM,SPDR Gold MiniShares,27261255680.0,2026-07-08,yfinance,ok,2026-07-08T14:47:07Z,
FBND,FBND,Fidelity Total Bond ETF,26618243072.0,2026-07-08,yfinance,ok,2026-07-08T14:44:53Z,
IUSV,IUSV,iShares Core S&P U.S. Value ETF,26456442880.0,2026-07-08,yfinance,ok,2026-07-08T14:49:53Z,
VOOG,VOOG,Vanguard S&P 500 Growth Index Fund ETF Shares,26322757632.0,2026-07-08,yfinance,ok,2026-07-08T15:00:58Z,
AVEM,AVEM,Avantis Emerging Markets Equity ETF,26237122560.0,2026-07-08,yfinance,ok,2026-07-08T14:39:19Z,
EMXC,EMXC,iShares MSCI Emerging Markets ex China ETF,26057398272.0,2026-07-08,yfinance,ok,2026-07-08T14:44:07Z,
FNDX,FNDX,Schwab Fundamental U.S. Large Company ETF,25939793920.0,2026-07-08,yfinance,ok,2026-07-08T14:46:02Z,
DRAM,DRAM,Roundhill Memory ETF,25910761472.0,2026-07-08,yfinance,ok,2026-07-08T14:43:12Z,
IYW,IYW,iShares U.S. Technology ETF,25393864704.0,2026-07-08,yfinance,ok,2026-07-08T14:50:11Z,
SHY,SHY,iShares 1-3 Year Treasury Bond ETF,25358272512.0,2026-07-08,yfinance,ok,2026-07-08T14:57:21Z,
CGGR,CGGR,Capital Group Growth ETF,24842137600.0,2026-07-08,yfinance,ok,2026-07-08T14:41:31Z,
RDVY,RDVY,First Trust Rising Dividend Achievers ETF,24483407872.0,2026-07-08,yfinance,ok,2026-07-08T14:55:57Z,
EWY,EWY,iShares MSCI South Korea ETF,24467890176.0,2026-07-08,yfinance,ok,2026-07-08T14:44:43Z,
SCHA,SCHA,Schwab U.S. Small-Cap ETF,24157184000.0,2026-07-08,yfinance,ok,2026-07-08T14:56:47Z,
FNDF,FNDF,Schwab Fundamental International Equity ETF,23990886400.0,2026-07-08,yfinance,ok,2026-07-08T14:46:02Z,
EFV,EFV,iShares MSCI EAFE Value ETF,23718227968.0,2026-07-08,yfinance,ok,2026-07-08T14:43:51Z,
XLU,XLU,State Street Utilities Select Sector SPDR ETF,23111417856.0,2026-07-08,yfinance,ok,2026-07-08T15:01:58Z,
USMV,USMV,iShares MSCI USA Min Vol Factor ETF,23007752192.0,2026-07-08,yfinance,ok,2026-07-08T15:00:16Z,
DVY,DVY,iShares Select Dividend ETF,22900787200.0,2026-07-08,yfinance,ok,2026-07-08T14:43:26Z,
GDX,GDX,VanEck Gold Miners ETF,22753128448.0,2026-07-08,yfinance,ok,2026-07-08T14:46:53Z,
XLY,XLY,State Street Consumer Discretionary Select Sector SPDR ETF,22593435648.0,2026-07-08,yfinance,ok,2026-07-08T15:01:59Z,
IGSB,IGSB,iShares 1-5 Year Investment Grade Corporate Bond ETF,22337937408.0,2026-07-08,yfinance,ok,2026-07-08T14:49:11Z,
EWJ,EWJ,iShares MSCI Japan ETF,22312462336.0,2026-07-08,yfinance,ok,2026-07-08T14:44:38Z,
XLC,XLC,State Street Communication Services Select Sector SPDR ETF,22262224896.0,2026-07-08,yfinance,ok,2026-07-08T15:01:52Z,
SPMO,SPMO,Invesco S&P 500 Momentum ETF,22210627584.0,2026-07-08,yfinance,ok,2026-07-08T14:58:05Z,
IWP,IWP,iShares Russell Mid-Cap Growth ETF,21568610304.0,2026-07-08,yfinance,ok,2026-07-08T14:50:03Z,
VONV,VONV,Vanguard Russell 1000 Value Index Fund ETF Shares,21457317888.0,2026-07-08,yfinance,ok,2026-07-08T15:00:57Z,
SDY,SDY,State Street SPDR S&P Dividend ETF,21393180672.0,2026-07-08,yfinance,ok,2026-07-08T14:57:04Z,
DFUS,DFUS,Dimensional U.S. Equity Market ETF,21026164736.0,2026-07-08,yfinance,ok,2026-07-08T14:42:54Z,
FTEC,FTEC,Fidelity MSCI Information Technology Index ETF,20956467200.0,2026-07-08,yfinance,ok,2026-07-08T14:46:22Z,
SHV,SHV,iShares 0–1 Year Treasury Bond ETF,20945842176.0,2026-07-08,yfinance,ok,2026-07-08T14:57:21Z,
IQMM,IQMM,Proshares Genius Money Market ETF,20518305792.0,2026-07-08,yfinance,ok,2026-07-08T14:49:38Z,
VHT,VHT,Vanguard Health Care Index Fund ETF Shares,20388290560.0,2026-07-08,yfinance,ok,2026-07-08T15:00:48Z,
VYMI,VYMI,Vanguard International High Dividend Yield Index Fund ETF Shares,20381085696.0,2026-07-08,yfinance,ok,2026-07-08T15:01:15Z,
SPHQ,SPHQ,Invesco S&P 500 Quality ETF,20360812544.0,2026-07-08,yfinance,ok,2026-07-08T14:58:02Z,
OEF,OEF,iShares S&P 100 ETF,20043581440.0,2026-07-08,yfinance,ok,2026-07-08T14:53:44Z,
DFIV,DFIV,Dimensional International Value ETF,19862159360.0,2026-07-08,yfinance,ok,2026-07-08T14:42:50Z,
IWV,IWV,iShares Russell 3000 ETF,19473276928.0,2026-07-08,yfinance,ok,2026-07-08T14:50:04Z,
AVDV,AVDV,Avantis International Small Cap Value ETF,19221213184.0,2026-07-08,yfinance,ok,2026-07-08T14:39:18Z,
VTWO,VTWO,Vanguard Russell 2000 Index Fund ETF Shares,18552160256.0,2026-07-08,yfinance,ok,2026-07-08T15:01:11Z,
IGIB,IGIB,iShares 5-10 Year Investment Grade Corporate Bond ETF,18526003200.0,2026-07-08,yfinance,ok,2026-07-08T14:49:08Z,
SPMD,SPMD,State Street SPDR Portfolio S&P 400 Mid Cap ETF,18386264064.0,2026-07-08,yfinance,ok,2026-07-08T14:58:05Z,
IEI,IEI,iShares 3-7 Year Treasury Bond ETF,18260961280.0,2026-07-08,yfinance,ok,2026-07-08T14:49:00Z,
USFR,USFR,WisdomTree Floating Rate Treasury Fund,17754787840.0,2026-07-08,yfinance,ok,2026-07-08T15:00:12Z,
ESGU,ESGU,iShares ESG Aware MSCI USA ETF,17746929664.0,2026-07-08,yfinance,ok,2026-07-08T14:44:20Z,
HYG,HYG,iShares iBoxx $ High Yield Corporate Bond ETF,17626118144.0,2026-07-08,yfinance,ok,2026-07-08T14:48:17Z,
USIG,USIG,iShares Broad USD Investment Grade Corporate Bond ETF,17618763776.0,2026-07-08,yfinance,ok,2026-07-08T15:00:13Z,
BBJP,BBJP,JPMorgan BetaBuilders Japan ETF,17599494144.0,2026-07-08,yfinance,ok,2026-07-08T14:39:43Z,
COWZ,COWZ,Pacer US Cash Cows 100 ETF,17594638336.0,2026-07-08,yfinance,ok,2026-07-08T14:41:58Z,
VMBS,VMBS,Vanguard Mortgage-Backed Securities Index Fund ETF Shares,17337255936.0,2026-07-08,yfinance,ok,2026-07-08T15:00:52Z,
SPEM,SPEM,State Street SPDR Portfolio Emerging Markets ETF,17305092096.0,2026-07-08,yfinance,ok,2026-07-08T14:58:00Z,
AVDE,AVDE,Avantis International Equity ETF,17163864064.0,2026-07-08,yfinance,ok,2026-07-08T14:39:17Z,
IWY,IWY,iShares Russell Top 200 Growth ETF,16964288512.0,2026-07-08,yfinance,ok,2026-07-08T14:50:05Z,
SPSM,SPSM,State Street SPDR Portfolio S&P 600 Small Cap ETF,16915987456.0,2026-07-08,yfinance,ok,2026-07-08T14:58:07Z,
EFG,EFG,iShares MSCI EAFE Growth ETF,16891213824.0,2026-07-08,yfinance,ok,2026-07-08T14:43:50Z,
DFAI,DFAI,Dimensional International Core Equity Market ETF,16829969408.0,2026-07-08,yfinance,ok,2026-07-08T14:42:43Z,
AVLV,AVLV,Avantis US Large Cap Value ETF,16735772672.0,2026-07-08,yfinance,ok,2026-07-08T14:39:22Z,
DGRW,DGRW,WisdomTree U.S. Quality Dividend Growth Fund,16599785472.0,2026-07-08,yfinance,ok,2026-07-08T14:42:57Z,
SCHP,SCHP,Schwab U.S. TIPS ETF,16518061056.0,2026-07-08,yfinance,ok,2026-07-08T14:56:52Z,
BINC,BINC,iShares Flexible Income Active ETF,16206218240.0,2026-07-08,yfinance,ok,2026-07-08T14:40:08Z,
SCHV,SCHV,Schwab U.S. Large-Cap Value ETF,15930595328.0,2026-07-08,yfinance,ok,2026-07-08T14:56:53Z,
STIP,STIP,iShares 0-5 Year TIPS Bond ETF,15883689984.0,2026-07-08,yfinance,ok,2026-07-08T14:58:24Z,
BAI,BAI,iShares A.I. Innovation and Tech Active ETF,15693548544.0,2026-07-08,yfinance,ok,2026-07-08T14:39:32Z,
IWS,IWS,iShares Russell Mid-Cap Value ETF,15646174208.0,2026-07-08,yfinance,ok,2026-07-08T14:50:04Z,
IWO,IWO,iShares Russell 2000 Growth ETF,15425412096.0,2026-07-08,yfinance,ok,2026-07-08T14:50:03Z,
GSLC,GSLC,Goldman Sachs ActiveBeta U.S. Large Cap Equity ETF,15385732096.0,2026-07-08,yfinance,ok,2026-07-08T14:47:30Z,
SCHM,SCHM,Schwab U.S. Mid-Cap ETF,15320031232.0,2026-07-08,yfinance,ok,2026-07-08T14:56:52Z,
DFUV,DFUV,Dimensional US Marketwide Value ETF,15314369536.0,2026-07-08,yfinance,ok,2026-07-08T14:42:54Z,
DFAS,DFAS,Dimensional U.S. Small Cap ETF,15242885120.0,2026-07-08,yfinance,ok,2026-07-08T14:42:44Z,
VGLT,VGLT,Vanguard Long-Term Treasury Index Fund ETF Shares,15153465344.0,2026-07-08,yfinance,ok,2026-07-08T15:00:46Z,
PYLD,PYLD,PIMCO ETF Trust - PIMCO Multisector Bond Active Exchange-Traded Fund,14711611392.0,2026-07-08,yfinance,ok,2026-07-08T14:55:13Z,
TIP,TIP,iShares TIPS Bond ETF,14696782848.0,2026-07-08,yfinance,ok,2026-07-08T14:59:11Z,
EMB,EMB,iShares J.P. Morgan USD Emerging Markets Bond ETF,14615079936.0,2026-07-08,yfinance,ok,2026-07-08T14:43:57Z,
PAVE,PAVE,Global X U.S. Infrastructure Development ETF,14567146496.0,2026-07-08,yfinance,ok,2026-07-08T14:54:02Z,
IWN,IWN,iShares Russell 2000 Value ETF,14527014912.0,2026-07-08,yfinance,ok,2026-07-08T14:50:02Z,
ITA,ITA,iShares U.S. Aerospace & Defense ETF,14444112896.0,2026-07-08,yfinance,ok,2026-07-08T14:49:46Z,
SCZ,SCZ,iShares MSCI EAFE Small-Cap ETF,14441042944.0,2026-07-08,yfinance,ok,2026-07-08T14:56:59Z,
DFAT,DFAT,Dimensional U.S. Targeted Value ETF,14320157696.0,2026-07-08,yfinance,ok,2026-07-08T14:42:44Z,
DFIC,DFIC,Dimensional International Core Equity 2 ETF,14218919936.0,2026-07-08,yfinance,ok,2026-07-08T14:42:49Z,
CIBR,CIBR,First Trust NASDAQ Cybersecurity ETF,13836617728.0,2026-07-08,yfinance,ok,2026-07-08T14:41:40Z,
AVUS,AVUS,Avantis US Equity ETF,13827512320.0,2026-07-08,yfinance,ok,2026-07-08T14:39:28Z,
VPL,VPL,Vanguard FTSE Pacific Index Fund ETF Shares,13825753088.0,2026-07-08,yfinance,ok,2026-07-08T15:01:01Z,
VSS,VSS,Vanguard FTSE All-World ex-US Small-Cap Index Fund ETF Shares,13810126848.0,2026-07-08,yfinance,ok,2026-07-08T15:01:05Z,
VFH,VFH,Vanguard Financials Index Fund ETF Shares,13808313344.0,2026-07-08,yfinance,ok,2026-07-08T15:00:42Z,
HDV,HDV,iShares Core High Dividend ETF,13659947008.0,2026-07-08,yfinance,ok,2026-07-08T14:47:52Z,
XLP,XLP,State Street Consumer Staples Select Sector SPDR ETF,13649293312.0,2026-07-08,yfinance,ok,2026-07-08T15:01:56Z,
IQLT,IQLT,iShares MSCI Intl Quality Factor ETF,13642241024.0,2026-07-08,yfinance,ok,2026-07-08T14:49:37Z,
FIMU,FIMU,Fidelity Intermediate Municipal Income Fund ETF,13629500416.0,2026-07-08,yfinance,ok,2026-07-08T14:45:31Z,
SPTM,SPTM,State Street SPDR Portfolio S&P 1500 Composite Stock Market ETF,13582209024.0,2026-07-08,yfinance,ok,2026-07-08T14:58:09Z,
JCPB,JCPB,JPMorgan Core Plus Bond ETF,13578677248.0,2026-07-08,yfinance,ok,2026-07-08T14:50:18Z,
IGV,IGV,iShares Expanded Tech-Software Sector ETF,13542322176.0,2026-07-08,yfinance,ok,2026-07-08T14:49:12Z,
SCHR,SCHR,Schwab Intermediate-Term U.S. Treasury ETF,13378999296.0,2026-07-08,yfinance,ok,2026-07-08T14:56:53Z,
MGV,MGV,Vanguard Mega Cap Value Index Fund,13311754240.0,2026-07-08,yfinance,ok,2026-07-08T14:52:16Z,
ESGV,ESGV,Vanguard ESG U.S. Stock ETF,13178104832.0,2026-07-08,yfinance,ok,2026-07-08T14:44:21Z,
QQQI,QQQI,NEOS NASDAQ-100(R) High Income ETF,13110758400.0,2026-07-08,yfinance,ok,2026-07-08T14:55:37Z,
PFF,PFF,iShares Preferred and Income Securities ETF,13096669184.0,2026-07-08,yfinance,ok,2026-07-08T14:54:20Z,
SCHO,SCHO,Schwab Short-Term U.S. Treasury ETF,12952873984.0,2026-07-08,yfinance,ok,2026-07-08T14:56:52Z,
BOXX,BOXX,Alpha Architect 1-3 Month Box ETF,12697272320.0,2026-07-08,yfinance,ok,2026-07-08T14:40:32Z,
SCHE,SCHE,Schwab Emerging Markets Equity ETF,12488486912.0,2026-07-08,yfinance,ok,2026-07-08T14:56:49Z,
DUHP,DUHP,Dimensional US High Profitability ETF,12324184064.0,2026-07-08,yfinance,ok,2026-07-08T14:43:20Z,
DFAU,DFAU,Dimensional US Core Equity Market ETF,12301299712.0,2026-07-08,yfinance,ok,2026-07-08T14:42:45Z,
AMLP,AMLP,Alerian MLP ETF,12160584704.0,2026-07-08,yfinance,ok,2026-07-08T14:38:51Z,
GRID,GRID,First Trust NASDAQ Clean Edge Smart Grid Infrastructure Index Fund,12076603392.0,2026-07-08,yfinance,ok,2026-07-08T14:47:23Z,
CGGO,CGGO,Capital Group Global Growth Equity ETF,11956222976.0,2026-07-08,yfinance,ok,2026-07-08T14:41:30Z,
DFAX,DFAX,Dimensional World ex U.S. Core Equity 2 ETF,11913159680.0,2026-07-08,yfinance,ok,2026-07-08T14:42:45Z,
PVAL,PVAL,Putnam Focused Large Cap Value ETF,11873768448.0,2026-07-08,yfinance,ok,2026-07-08T14:55:07Z,
ESGD,ESGD,iShares ESG Aware MSCI EAFE ETF,11761851392.0,2026-07-08,yfinance,ok,2026-07-08T14:44:20Z,
MOAT,MOAT,VanEck Morningstar Wide Moat ETF,11624555520.0,2026-07-08,yfinance,ok,2026-07-08T14:52:32Z,
ACWX,ACWX,iShares MSCI ACWI ex U.S. ETF,11616678912.0,2026-07-08,yfinance,ok,2026-07-08T14:38:24Z,
SCHI,SCHI,Schwab 5-10 Year Corporate Bond ETF,11602564096.0,2026-07-08,yfinance,ok,2026-07-08T14:56:51Z,
SPIB,SPIB,State Street SPDR Portfolio Intermediate Term Corporate Bond ETF,11570174976.0,2026-07-08,yfinance,ok,2026-07-08T14:58:02Z,
NOBL,NOBL,ProShares S&P 500 Dividend Aristocrats ETF,11533949952.0,2026-07-08,yfinance,ok,2026-07-08T14:53:16Z,
AIRR,AIRR,First Trust RBA American Industrial RenaissanceTM ETF,11489859584.0,2026-07-08,yfinance,ok,2026-07-08T14:38:42Z,
VONE,VONE,Vanguard Russell 1000 Index Fund ETF Shares,11460844544.0,2026-07-08,yfinance,ok,2026-07-08T15:00:56Z,
SUB,SUB,iShares Short-Term National Muni Bond ETF,11377924096.0,2026-07-08,yfinance,ok,2026-07-08T14:58:29Z,
SDVY,SDVY,First Trust SMID Cap Rising Dividend Achievers ETF,11351064576.0,2026-07-08,yfinance,ok,2026-07-08T14:57:03Z,
SPHY,SPHY,State Street SPDR Portfolio High Yield Bond ETF,11327878144.0,2026-07-08,yfinance,ok,2026-07-08T14:58:02Z,
IJK,IJK,iShares S&P Mid-Cap 400 Growth ETF,11298716672.0,2026-07-08,yfinance,ok,2026-07-08T14:49:16Z,
TLH,TLH,iShares 10-20 Year Treasury Bond ETF,11252374528.0,2026-07-08,yfinance,ok,2026-07-08T14:59:17Z,
PBUS,PBUS,Invesco MSCI USA ETF,11176468480.0,2026-07-08,yfinance,ok,2026-07-08T14:54:08Z,
EWT,EWT,iShares MSCI Taiwan ETF,11151458304.0,2026-07-08,yfinance,ok,2026-07-08T14:44:41Z,
JIRE,JIRE,JPMorgan International Research Enhanced Equity ETF,11130201088.0,2026-07-08,yfinance,ok,2026-07-08T14:50:32Z,
SCHH,SCHH,Schwab U.S. REIT ETF,11128644608.0,2026-07-08,yfinance,ok,2026-07-08T14:56:50Z,
CGUS,CGUS,Capital Group Core Equity ETF,11122103296.0,2026-07-08,yfinance,ok,2026-07-08T14:41:35Z,
VDE,VDE,Vanguard Energy Index Fund ETF Shares,11076583424.0,2026-07-08,yfinance,ok,2026-07-08T15:00:37Z,
DFCF,DFCF,Dimensional Core Fixed Income ETF,10866136064.0,2026-07-08,yfinance,ok,2026-07-08T14:42:46Z,
IGF,IGF,iShares Global Infrastructure ETF,10779330560.0,2026-07-08,yfinance,ok,2026-07-08T14:49:07Z,
VPU,VPU,Vanguard Utilities Index Fund ETF Shares,10763640832.0,2026-07-08,yfinance,ok,2026-07-08T15:01:01Z,
IAGG,IAGG,iShares Core International Aggregate Bond ETF,10738313216.0,2026-07-08,yfinance,ok,2026-07-08T14:48:24Z,
XBI,XBI,State Street SPDR S&P Biotech ETF,10734887936.0,2026-07-08,yfinance,ok,2026-07-08T15:01:41Z,
IGM,IGM,iShares Expanded Tech Sector ETF,10708001792.0,2026-07-08,yfinance,ok,2026-07-08T14:49:09Z,
ONEQ,ONEQ,Fidelity Nasdaq Composite Index ETF,10687616000.0,2026-07-08,yfinance,ok,2026-07-08T14:53:48Z,
SPSB,SPSB,State Street SPDR Portfolio Short Term Corporate Bond ETF,10633097216.0,2026-07-08,yfinance,ok,2026-07-08T14:58:06Z,
SCHZ,SCHZ,Schwab U.S. Aggregate Bond ETF,10601679872.0,2026-07-08,yfinance,ok,2026-07-08T14:56:54Z,
VLUE,VLUE,iShares MSCI USA Value Factor ETF,10583302144.0,2026-07-08,yfinance,ok,2026-07-08T15:00:52Z,
MGC,MGC,Vanguard Mega Cap Index Fund,10574559232.0,2026-07-08,yfinance,ok,2026-07-08T14:52:14Z,
BBCA,BBCA,JPMorgan BetaBuilders Canada ETF,10509565952.0,2026-07-08,yfinance,ok,2026-07-08T14:39:40Z,
SPTL,SPTL,State Street SPDR Portfolio Long Term Treasury ETF,10471982080.0,2026-07-08,yfinance,ok,2026-07-08T14:58:08Z,
AIQ,AIQ,Global X Artificial Intelligence & Technology ETF,10413852672.0,2026-07-08,yfinance,ok,2026-07-08T14:38:41Z,
SPYI,SPYI,Neos S&P 500(R) High Income ETF,10406321152.0,2026-07-08,yfinance,ok,2026-07-08T14:58:15Z,
FENI,FENI,Fidelity Enhanced International ETF,10288922624.0,2026-07-08,yfinance,ok,2026-07-08T14:45:17Z,
XLG,XLG,Invesco S&P 500 Top 50 ETF,10253615104.0,2026-07-08,yfinance,ok,2026-07-08T15:01:54Z,
FBTC,FBTC,Fidelity Wise Origin Bitcoin Fund,10223253504.0,2026-07-08,yfinance,ok,2026-07-08T14:44:54Z,
